id,name,area,experience,description,key_skills,employer,alternate_url,from,to,currency
77942886,"Backend программист Python (middle, senior)",Москва,От 3 до 6 лет,"ООО АК - поставщик программного обеспечения и интегратор онлайн-бухгалтерий с многолетним опытом. Мы – профессиональный и молодой коллектив разработчиков, нацеленный на результат. Проект развивается уже более 3 лет и рассчитан на много лет вперед. В связи с расширением команды, мы ищем в штат Python разработчика уровня Middle/Senior на полную ставку. Проект: работа над продуктом, связанным с новой системой налогообложения АУСНКомпания работает с банками РФ, продвигая сервис взаимодействия банков с ФНС Стек разработки: Python (FastAPI) + PostgreSQL + ELK + kafka + cryptopro Опыт написания микросервисов, понимание микросервисной архитектуры; Опыт работы с ОС семейства Linux. Написание базовой тех документации Docker , docker-compose, Kubernetes Условия:- Вопрос заработной платы готовы обсуждать по результатам собеседования;- Трудоустройство по ТК РФ, полностью ""белая"" заработная плата;- Полная занятость, 5/2;- Офис в Уфе, Москве или удаленная работа. Компания АК является аккредитованной IT-компанией, зарегистрированной в реестре Министерства цифрового развития.  ","['Linux', 'PostgreSQL', 'Python', 'Kafka', 'ELK', 'Git']",Ак,https://hh.ru/vacancy/77942886,,120000.0,RUR
77997327,Python разработчик,Санкт-Петербург,От 1 года до 3 лет,"GARPIX – это крупнейший Digital-интегратор, создающий комплексные IT-решения. Мы специализируемся на разработке сложных веб и мобильных (iOS, Android) проектах, системах автоматизации бизнес-процессов, разработке собственного ПО. Нам доверяют крупные коммерческие и государственные организации, потому что мы умеем и любим выполнять нестандартные задачи, требующие большой ответственности. В связи с расширением штата мы находимся в поиске Python разработчика. Мы предлагаем:  Возможность постоянного профессионального роста (прозрачная система грейдирования); Работу над крупными проектами наших партнеров в России и за рубежом (фарма, ритейл, логистика, медицина и многие другие); Высокую конкурентную заработную плату (выплаты 2 раза в месяц); Квартальные премии, 13-ю заработную плату за достижения в течение года; Официальное оформление по ТК РФ; Работу в комфортабельном просторном офисе с современным оборудованием в центре города или удаленно из дома; Корпоративные клубы (спортивный, гик-, кибер-, настольных игр, киноклуб, робототехники, английского языка); Дружный и позитивный коллектив, адекватное руководство, открытость и поощрение инициатив; Скидки на обучение в GARPIX Digital Academy.  От кандидата мы ожидаем:  Опыт коммерческой разработки на Python более 2 лет; Уверенные знания и использование в работе Python (3.x), Django, Flask Адаптивная верстка Понимание REST; Опыт работы с Redis, Celery, Docker; Опыт с асинхронными фреймворками приветствуем; Знание принципов и паттернов ООП, умение применять их на практике; Опыт работы с системами контроля версий (мы используем git); Умение разбираться в чужом коде; Умение писать автотесты на свой код; Понимание принципов построения API.  Будет плюсом:  Опыт разработки на ReactJS более 1 года; Опыт с open-source ETL решениями; Знание шаблонов облачных решений; Хорошее понимание HTTP-протокола; Опыт работы с Jira, Confluence; Понимание принципов DevOps, CI/CD на базе Gitlab/Jenkins. ","['ООП', 'Python', 'Django Framework', 'PostgreSQL', 'Работа в команде', 'REST', 'Веб-программирование', 'Redis', 'Docker', 'Linux', 'CI/CD', 'SQL']",Гарпикс,https://hh.ru/vacancy/77997327,,250000.0,RUR
73118539,Senior Data Engineer (Search),Москва,От 3 до 6 лет,"Мы в поиске сильных DE в уютную команду, которая развивает мультиплатформенный аудиосервис на благо слушателя. Сейчас мы движемся от централизованной работы с данными в монолитных командах к платформенно-продуктовой парадигме (DataMesh) и нам предстоит большая работа по созданию этой самой платформы. Чем нужно будет заниматься?  поддержка и написание etl-процессов для наполнения индексов в elasticsearch; оптимизация запросов выгрузки данных/поисковых запросов в контакте с аналитиками; работа с индексами (создание, настройка); активное участие в группе по настройке и сопровождению кластеров Elastic.  А вот это нужно уметь:  знание Python (std_lib, GIL, magic methods); опыт создания ETL\ELT-процедур; знание SQL (индексы, оконные функции); практический опыт работы с Hadoop, PySpark, AirFlow.  Опыт работы с Elasticsearch:  понимание принципов работы; умение диагностировать проблемы; опыт написания запросов (полнотекстовый поиск, агрегации, скрипты сортировки).  Работа должна быть в удовольствие, поэтому ты получаешь:  все преимущества работы в аккредитованной IT-компании; возможность делать продукт, который вдохновляет, приносит пользу и которым пользуются миллионы; возможность работать удаленно или в гибридном графике, выбирать начало и окончание рабочего дня, брать дополнительные дни отпуска; а если ты выбираешь работу в офисе - стильное рабочее пространство рядом с м. Кутузовская (7 минут от метро и МЦК); ДМС со стоматологией с первого рабочего дня для тебя и для твоего питомца; заботу о психологическом здоровье и компенсацию затрат на платформе «Ясно»; полезные завтраки и перекусы в офисе каждый день; занятия в офисном спортзале, йогу и фитнес, компенсацию затрат на спорт; оплату участия в конференциях и помощь в подготовке выступлений, скидки на изучение английского, доступ к корпоративным обучающим ресурсам; возможность делиться новостями и экспертизой с коллегами на ежемесячных митапах и внутренних мероприятиях; вечеринки с артистами в офисе и проходки на их концерты!  Приходи в Звук слушать музыку, жить музыкой, творить музыку. Не работа, а удовольствие!","['Python', 'SQL', 'Hadoop', 'AirFlow', 'PySpark', 'Elasticsearch']",Звук,https://hh.ru/vacancy/73118539,,,
69614008,Senior Data Engineer (DataPlatform team),Москва,От 3 до 6 лет,"Мы в поиске сильных DE в уютную команду, которая развивает мультиплатформенный аудиосервис на благо слушателя. Сейчас мы движемся от централизованной работы с данными в монолитных командах к платформенно-продуктовой парадигме (DataMesh) и нам предстоит большая работа по созданию этой самой платформы. Чем нужно будет заниматься?  участвовать в трансформации ETL из родного overnight batching в модный молодёжный realtime streaming; разрабатывать self-service инструменты платформы данных для реализации DataMesh; интегрировать хранилища, каталог данных, dbt, CDC движок, DQ, мониторинги; обучать младших коллег, помогать аналитикам, продвигать лучшие практики работы с данными.  А вот это нужно для работы:  релевантный опыт работы от 2-х лет; опыт создания ETL-процедур; опыт работы с batch обработкой данных; знание Python, SQL; практический опыт работы с Hadoop, Spark, AirFlow, Presto; знакомство с kubernetes и опыт его использования в работе.  Будет плюсом:  опыт работы со stream обработкой данных; знание Scala, опыт работы с Kafka и Flink; навыки работы с CDC; опыт внедрения инструментов контроля качества данных; опыт создания self-service инструментов и платформенных решений; навыки успешного взаимодействия c data science командой.  Работа должна быть в удовольствие, поэтому ты получаешь:  все преимущества работы в аккредитованной IT-компании; возможность делать продукт, который вдохновляет, приносит пользу и которым пользуются миллионы; возможность работать удаленно или в гибридном графике, выбирать начало и окончание рабочего дня, брать дополнительные дни отпуска; а если ты выбираешь работу в офисе - стильное рабочее пространство рядом с м. Кутузовская (7 минут от метро и МЦК); ДМС со стоматологией с первого рабочего дня для тебя и для твоего питомца; заботу о психологическом здоровье и компенсацию затрат на платформе «Ясно»; полезные завтраки и перекусы в офисе каждый день; занятия в офисном спортзале, йогу и фитнес, компенсацию затрат на спорт; оплату участия в конференциях и помощь в подготовке выступлений, скидки на изучение английского, доступ к корпоративным обучающим ресурсам; возможность делиться новостями и экспертизой с коллегами на ежемесячных митапах и внутренних мероприятиях; вечеринки с артистами в офисе и проходки на их концерты!  Приходи в Звук слушать музыку, жить музыкой, творить музыку. Не работа, а удовольствие!","['Python', 'Spark', 'SQL', 'Hadoop', 'AirFlow', 'Presto']",Звук,https://hh.ru/vacancy/69614008,,,
77998396,Devops разработчик,Москва,От 3 до 6 лет,"КОМПАНИЯ «АЙ-ТЕКО» - ведущий российский системный интегратор и поставщик информационных технологий для корпоративных заказчиков. Активно действует на рынке IT России с 1997 года, входит в ТОП-400 крупнейших российских компаний, ТОП-10 крупнейших IT-компаний России. В связи с активным развитием внутренних проектов в компании открыта вакансия Devops разработчик ЧТО ХОТИМ УВИДЕТЬ ОТ ВАС:    Опыт сборки и развертывания контейнеризированных приложений для OpenShift; Понимание технологий OpenShift, OpenStack, K8s, Hibernate; Опыт создания Deployment Configs, ConfigMaps с использованием Ansible; Навыки работы с Python/Groovy.  МЫ ГАРАНТИРУЕМ:  Работу в стабильной компании, белая заработная плата График работы 5/2 Формат работы: удаленка; Социальный пакет (медицинская страховка, включая стоматологию) Корпоративный спорт: скидки на посещение фитнес-клубов, футбольная и волейбольная секции Работа в команде, использующей гибкий подход к разработке Оформление в соответствии с ТК РФ с первого дня работы Работа в развивающемся IT-проекте с командой специалистов высокого уровня, возможность развития и обмена опытом, корпоративное обучение ","['OpenShift', 'OpenStack', 'K8s', 'Hibernate ORM', 'Deployment Configs', 'Python', 'Groovy']",ИЦ АЙ-ТЕКО,https://hh.ru/vacancy/77998396,,,
77397648,TechLead Research Engineer (NLP/Speech),Санкт-Петербург,От 3 до 6 лет,"Контур — экосистема для бизнеса. Каждая четвертая компания в стране решает бизнес-задачи, используя наши сервисы. Мы автоматизируем документооборот, бухгалтерию и отчетность. Делаем эти процессы простыми и быстрыми, а сервисы — удобными для клиента. Центр искусственного интеллекта в Контуре помогает зарабатывать деньги за счет технологий машинного обучения и больших данных. Например, чат-бот Сирена экономит около 25% времени консультантов техподдержки в чатах, а технология распознавания речи обрабатывает тысячи лет записей каждый год. Мы постоянно следим за прогрессом в технологиях и разрабатываем новые методы и алгоритмы, чтобы сделать инновации доступными для использования в продуктах и процессах компании. В Центре искусственного интеллекта представлены разные роли: есть дата сайентисты, разработчики и аналитики данных, девопсы, QA-специалисты, системные аналитики, проджекты и продакт-менеджеры. Свое железо (V100/A100) и асессорская служба позволяют нам не ограничивать себя при работе с чувствительными данными, а также крутая инфраструктурная команда создает, улучшает и развивает инструменты MLOps на любой вкус от ресерча до прода. Ищем эксперта, чтобы реализовывать и внедрять SOTA-подходы в наши сервисы. В лаборатории «Speech&NLP» Центра искусственного интеллекта команда (7 ML Research Engineer) запустила с нуля и масштабировала на всю компанию собственный ASR, сэкономив сотни миллионов рублей в год. Сейчас мы хотим аналогично создать и внедрить Text To Speech. Мы ищем опытного TechLead Speech/NLP Research Engineer. Чем предстоит заниматься   Взять на себя одно из направлений в лаборатории (например, Text To Speech).   Улучшать текущее решение ASR.   Участвовать в исследовании новых для лаборатории Speech технологий: denoising, voice cloning и другие.   Поддерживать и расширять набор NLP технологий: NER, sentiment analysis, spelling correction и другие.   Следить за свежими статьями и SOTA по Speech/NLP технологиям и делиться с командой.   Что ожидаем   Отличное понимание текущего состояния области Speech/NLP.   Черный пояс по PyTorch.   Умение рассказывать сложные вещи простым языком.   Будет плюсом   Знание и практический опыт с transformers, fairseq, Nemo, SpeechBrain, ONNX/TorchScript.   Знание методов обработки сигналов.   Опыт оптимизации/дистилляции DL-моделей для продакшена.   Публикации или блогпосты в области Speech/NLP.   Мы предлагаем  Зарплата зависит от ваших технических знаний и навыков. Пересматриваем ее два раза в год. Нам важно, чтобы вам было комфортно: непринципиально, где вы находитесь и во сколько начинаете рабочий день, главное – выполненные задачи. Умеем работать в команде, находясь в разных точках мира (Таллин, Ташкент, Астана, Лимассол, Екатеринбург, Москва и т. д.). Мы поддерживаем участие в конференциях, митапах и обучающих проектах. Наши деврелы помогут написать статью на Хабр, снять видео или подготовиться к выступлению на конференции. У нас сильное инженерное сообщество: регулярно проводим техническую конференцию КонфУР, обмениваемся опытом между командами, проводим дизайн-ревью с экспертами в разных технологиях. Всегда найдется, с кем посоветоваться. А еще у нас есть инженерный совет. Он придумывает и реализует проекты, которые улучшают жизнь инженеров в компании. Максимум горизонтальных связей в коллективе, чтобы быстрее договариваться и решать рабочие задачи.  Присоединяйтесь:)","['Python', 'PyTorch', 'NLP', 'SQL', 'Data Science', 'Speech', 'Ner']",Контур,https://hh.ru/vacancy/77397648,300000.0,400000.0,RUR
77992822,DevOps Engineer,Москва,От 3 до 6 лет,"Проект крупного российского банка, связанный с продуктом SDP Control. Он обеспечивает развертывание кластеров (а также технологических сервисов), настройку и управление ими Твои задачи:  Автоматизация и поддержка мониторинговых систем (Zabbix/Prometheus/ELK Stack) Разработка мониторинговых скриптов и дополнений на Python/Powershell Настройка функционала мониторинга (сбор метрик, генерация аварий, дашборды) Консультации по best practices мониторинга Разработка интеграций с другими сервисами банка Реализация CI/CD процессов развертывания системы мониторинга Перенастройка и развитие текущих pipeline-ов Автоматизация пост  Мы ждем от тебя:  Опыт использования Prometheus/Thanos/Cortex Опыт использования Grafana Опыт работы Kubernetes/OpenShift Опыт работы с Linux Опыт написания Bash скриптов Опыт использования Terraform Опыт работы Ansible Знание Python Опыт работы с Loki/ELK/Graylog/Splunk – предпочтительно Loki  Будет плюсом:  Владение стеком Hadoop: HDFS, Yarn, Zookeeper, Spark, Ambari Владение Golang Опыт работы с Kafka Опыт работы с Jenkins/Gitlab-ci/Bamboo, предпочтительно Jenkins Опыт работы с Nginx/Istio/Envoy Опыт работы с Helm Навык написания SQL запросов Опыт администрирования одной из баз данных – PostgreSQL/Greenplum/Oracle/Terradata ","['Bash', 'Linux', 'Jenkins', 'OpenShift', 'DevOps', 'Ansible', 'CI/CD', 'Prometheus']",Лига Цифровой Экономики,https://hh.ru/vacancy/77992822,,,
