id,name,area,type,published_at,created_at,archived,url,alternate_url,employer,from,to,currency,gross,requirement,responsibility
69616727,Python developer,Москва,Открытая,2022-09-08T12:40:08+0300,2022-09-08T12:40:08+0300,False,https://api.hh.ru/vacancies/69616727?host=hh.ru,https://hh.ru/vacancy/69616727,«Баланс-Платформа»,,,,,"<highlighttext>Python</highlighttext>3.6+ (Flask, FastAPI, Django). Pytest. PostgreSQL. RabbitMQ. K8s. Хорошее знание стандартной библиотеки <highlighttext>python</highlighttext> версии 3...",Реализация банковских продуктов на <highlighttext>Python</highlighttext> 3.6+. Развитие текущих и разработка новых сервисов. Документирование разработанного ПО. Написание unit-тестов...
55289291,Разработчик Python + Java / Backend Developer,Пермь,Открытая,2022-09-26T13:58:35+0300,2022-09-26T13:58:35+0300,False,https://api.hh.ru/vacancies/55289291?host=hh.ru,https://hh.ru/vacancy/55289291,DIGITAL FUTURE SYSTEMS,110000.0,,RUR,False,"Опыт коммерческой разработки от 1 года. Знание SQL обязательно на среднем уровне (select, сложные запросы на выборку, группировку, объединение, создание...",Доработка (кастомизация) инструментов BI-платформы под нужды аналитики (<highlighttext>Python</highlighttext>). Разработка аналитической отчетности с использованием инструментария BI-платформы. Разработка backend на...
70348228,Senior/Middle Python разработчик,Москва,Открытая,2022-09-26T12:49:34+0300,2022-09-26T12:49:34+0300,False,https://api.hh.ru/vacancies/70348228?host=hh.ru,https://hh.ru/vacancy/70348228,Деньги Вперед,,,,,Хорошие знания <highlighttext>Python</highlighttext>. Опыт разработки проектов на Django/Flask/FastAPI. Опыт коммерческой разработки 3+ лет. Опыт в проектировании API. ,"Принимать прямое участие в создании продукта, который несет реальную пользу людям и быстро растет."
69612685,Разработчик Python/Django (Middle),Москва,Открытая,2022-09-08T11:36:37+0300,2022-09-08T11:36:37+0300,False,https://api.hh.ru/vacancies/69612685?host=hh.ru,https://hh.ru/vacancy/69612685,AlfaBit.Group,180000.0,250000.0,RUR,False,"Отличное знание <highlighttext>Python</highlighttext>, Django, Celery, PostgreSQL, Redis, ClickHouse (желателен опыт работы от 3-х лет). Опыт написания unit-тестов. ","Участие в разработке проектов в сфере блокчейн технологий. Разработка backend (REST API ) для сервисов, как в рамках новых проектов, так..."
70401918,"Backend-разработчик (Python)/Риск-менеджмент, Департамент управленческого консультирования",Новосибирск,Открытая,2022-09-27T11:17:48+0300,2022-09-27T11:17:48+0300,False,https://api.hh.ru/vacancies/70401918?host=hh.ru,https://hh.ru/vacancy/70401918,Деловые Решения и Технологии (ДРТ),,,,,"Отличное владение языком <highlighttext>Python</highlighttext> (Django framework, general knowledge). Опыт в области разработки Web API — один год и более. ",Участие в разработке инновационных решений по управлению кредитными рисками совместно с командами аналитиков и специалистов по ИТ-инфраструктуре. 
69088658,Разработчик RPA,Москва,Открытая,2022-09-21T16:16:02+0300,2022-09-21T16:16:02+0300,False,https://api.hh.ru/vacancies/69088658?host=hh.ru,https://hh.ru/vacancy/69088658,Гринатом,,,,,"Знание <highlighttext>Python</highlighttext> (Selenium, BeautifulSoup), VBA, VB.NET. Желателен опыт использования платформ: UiPath, Blueprism, Workfusion, Redwood, Automation Anywhere. Базовые знания SQL, командной...",Автоматизация кадровых и бухгалтерских задач: разработка скриптов роботизации на <highlighttext>Python</highlighttext>. Документирование разработок. Участие в презентациях.
70337221,Код-ревьюер на курс “Асинхронное программирование на Python”,Москва,Открытая,2022-09-26T10:29:02+0300,2022-09-26T10:29:02+0300,False,https://api.hh.ru/vacancies/70337221?host=hh.ru,https://hh.ru/vacancy/70337221,Яндекс Практикум,,,,,Разработчик middle+ уровня и имеете опыт работы от трёх лет. Умеете доступно и последовательно объяснять сложные темы и задачи в...,Проверять написанный студентом код и давать обратную связь. Именно код-ревьюер решает: зачесть задание или нет. А ещё он даёт...
70401938,"Backend-разработчик (Python)/Риск-менеджмент, Департамент управленческого консультирования",Екатеринбург,Открытая,2022-09-27T11:18:16+0300,2022-09-27T11:18:16+0300,False,https://api.hh.ru/vacancies/70401938?host=hh.ru,https://hh.ru/vacancy/70401938,Деловые Решения и Технологии (ДРТ),,,,,"Отличное владение языком <highlighttext>Python</highlighttext> (Django framework, general knowledge). Опыт в области разработки Web API — один год и более. ",Участие в разработке инновационных решений по управлению кредитными рисками совместно с командами аналитиков и специалистов по ИТ-инфраструктуре. 
69895621,Python Backend Разработчик,Астана,Открытая,2022-09-16T13:31:52+0300,2022-09-16T13:31:52+0300,False,https://api.hh.ru/vacancies/69895621?host=hh.ru,https://hh.ru/vacancy/69895621,Adizit,400000.0,800000.0,KZT,False,"Знание Django, Flask, FastAPI, опыт разработки от 3 лет. Знание библиотек Pundas, Numpy. Знание JavaScript, HTML, CSS и их фреймворков. ","Оптимизация веб-приложений и веб-сайтов. Доработка функциональности на Django, Flask, FastAPI. Работа над улучшением дизайна, функциональности. Внедрение новых сервисов..."
70348277,Lead Python разработчик,Москва,Открытая,2022-09-26T12:50:22+0300,2022-09-26T12:50:22+0300,False,https://api.hh.ru/vacancies/70348277?host=hh.ru,https://hh.ru/vacancy/70348277,Деньги Вперед,,,,,Хорошие знания <highlighttext>Python</highlighttext>. Опыт разработки проектов на Django/Flask/FastAPI. Опыт коммерческой разработки 5+ лет. Опыт в проектировании распределенных...,"Принимать прямое участие в создании продукта, который несет реальную пользу людям и быстро растет."
69573552,Программист,Москва,Открытая,2022-09-07T13:20:53+0300,2022-09-07T13:20:53+0300,False,https://api.hh.ru/vacancies/69573552?host=hh.ru,https://hh.ru/vacancy/69573552,Кварта-Рад,120000.0,240000.0,RUR,True,"Умение писать чистый, читаемый, легко поддерживаемый код на <highlighttext>Python</highlighttext>. Знание основных методов в пакетах numpy, pandas, sklearn, matplotlib, прочее. ",
69775842,Аналитик-разработчик в «Безопасный интернет»,Москва,Открытая,2022-09-13T17:45:06+0300,2022-09-13T17:45:06+0300,False,https://api.hh.ru/vacancies/69775842?host=hh.ru,https://hh.ru/vacancy/69775842,Яндекс,,,,,"Нацелены на решение конкретной задачи, а не на абстрактные исследования.",Формализовать проблемы в виде офлайн- и онлайн-метрик. Внедрять модели в поисковый рантайм. Проводить A/B-эксперименты. Разрабатывали на <highlighttext>Python</highlighttext>...
69791866,Data engineer (Python Hadoop Spark),Москва,Открытая,2022-09-14T09:35:38+0300,2022-09-14T09:35:38+0300,False,https://api.hh.ru/vacancies/69791866?host=hh.ru,https://hh.ru/vacancy/69791866,Х5 Group,,,,,"Опыт работы с docker (kubernetes, pyspark, airflow и ds фреймворков <highlighttext>python</highlighttext>– не обязательно, но будет плюсом). Умение пользоваться git'ом...","Написание пайплайнов по работе с данными с использованием Airflow, Spark (пример: регулярный расчет фичей для модели, построение витрин с данными. "
69695405,ETL-разработчик (уровень не ниже среднего),Москва,Открытая,2022-10-06T09:11:33+0300,2022-10-06T09:11:33+0300,False,https://api.hh.ru/vacancies/69695405?host=hh.ru,https://hh.ru/vacancy/69695405,7RedLines,140000.0,180000.0,RUR,False,"Опыт в языках программирования и технологий: SQL, <highlighttext>Python</highlighttext>. Опыт работы с базами данных: Greenplum, Hadoop, PostgreSQL, Azure SQL, MS SQL...","Дизайн и разработка витрин данных. Проектирование, разработка и поддержка ETL-процессов для загрузки данных в/из Data Lake. "
67029599,Инженер-программист Python,Екатеринбург,Открытая,2022-09-07T14:46:44+0300,2022-09-07T14:46:44+0300,False,https://api.hh.ru/vacancies/67029599?host=hh.ru,https://hh.ru/vacancy/67029599,Айдеко,,,,,"Понимание сетевых протоколов, модели OSI, протоколов прикладного уровня (HTTP, TLS, FTP, SMB). Опыт разработки на <highlighttext>python</highlighttext> или желание перейти из...",Диагностировать проблем и исправлять баги в инфраструктуре клиентов. Добавлять исправления обнаруженных багов в основной код продукта. Заниматься обучением инженеров технической...
68610452,Python back-end разработчик,Кострома,Открытая,2022-09-08T14:40:01+0300,2022-09-08T14:40:01+0300,False,https://api.hh.ru/vacancies/68610452?host=hh.ru,https://hh.ru/vacancy/68610452,ПромоДата,100000.0,,RUR,True,"Опыт разработки на <highlighttext>Python</highlighttext> 3.6 или выше, написание кода, работающего на разных версиях <highlighttext>Python</highlighttext> и ОС; контроль и работа...",Разработка общих модулей и их внедрение в существующие парсеры. Разработка парсеров сайтов и приложений. Разработка API. Участие в формировании архитектуры...
70413748,"Автор / Преподаватель курса ""Автоматизация тестирования ПО на языке Python"" (Онлайн)",Санкт-Петербург,Открытая,2022-09-27T14:01:47+0300,2022-09-27T14:01:47+0300,False,https://api.hh.ru/vacancies/70413748?host=hh.ru,https://hh.ru/vacancy/70413748,Level UP,,,,,Опыт в на позиции инженера по тестированию ПО (<highlighttext>python</highlighttext>) / QA Automation Engineer от 2-х лет. Опыт менторства или обучения...,"Составление / Редактирование программы курса. Проведение вебинаров (по 2,5 часа, 2 раза в неделю). Проверка и разборы домашних заданий. "
51099029,Python Developer,Санкт-Петербург,Открытая,2022-09-19T16:20:47+0300,2022-09-19T16:20:47+0300,False,https://api.hh.ru/vacancies/51099029?host=hh.ru,https://hh.ru/vacancy/51099029,ЕДИНЫЙ ЦУПИС,,,,,"Понимание специфики работы с потоками/процессами и асинхронностью в <highlighttext>Python</highlighttext>. Умение применять Docker в разработке. Умение анализировать поведение системы, работа...","Разрабатывать новые части системы (микросервисы, SOA). Проводить Code Review коллег. Покрывать написанный код тестами. Вести документирование технической части. "
69867626,Python Developer,Москва,Открытая,2022-09-15T17:04:57+0300,2022-09-15T17:04:57+0300,False,https://api.hh.ru/vacancies/69867626?host=hh.ru,https://hh.ru/vacancy/69867626,"Hi, Rockits!",,300000.0,RUR,False,Опыт Backend разработки сложных коммерческих проектов на <highlighttext>Python</highlighttext> от 4-х лет. Высшее инженерное образование. Плюсом будет опыт разработки на...,Backend разработка на <highlighttext>Python</highlighttext> в проектной команде до 15 человек. Разработка нового функционала и поддержка текущих проектов (соотношение зависит от...
55212183,Data Engineer,Москва,Открытая,2022-09-19T17:39:27+0300,2022-09-19T17:39:27+0300,False,https://api.hh.ru/vacancies/55212183?host=hh.ru,https://hh.ru/vacancy/55212183,Тинькофф,,,,,"Знание одного из языков программирования: <highlighttext>Python</highlighttext>, Java, Go. Знание основ ООП, теории алгоритмов, структур данных. Знание SQL. Опыт написания процессов...",Участие в разработке ядра продуктов Data Platform. Разработка и оптимизация процессов выгрузки данных.
69772933,Senior Python developer (MLOps),Турция,Открытая,2022-09-13T16:42:52+0300,2022-09-13T16:42:52+0300,False,https://api.hh.ru/vacancies/69772933?host=hh.ru,https://hh.ru/vacancy/69772933,Wisebits,3500.0,,EUR,False,Kafka. MySQL. Airflow.,Помогать data scientist-ам с продакшн кодом. Налаживать инфраструктуру и выполнять отдельные небольшие задачи. Погружаться в архитектуру проекта и активно...
69683373,Python Developer,Москва,Открытая,2022-09-11T11:55:06+0300,2022-09-11T11:55:06+0300,False,https://api.hh.ru/vacancies/69683373?host=hh.ru,https://hh.ru/vacancy/69683373,ИЦ АЙ-ТЕКО,,,,,"<highlighttext>Python</highlighttext> 3, опыт разработки от 2-х лет. Django 2, DRF / Flask. Опыт работы с базами данных, ORM. ",
55856392,Senior Python developer (MLOps),Москва,Открытая,2022-09-15T15:40:21+0300,2022-09-15T15:40:21+0300,False,https://api.hh.ru/vacancies/55856392?host=hh.ru,https://hh.ru/vacancy/55856392,Wisebits,3500.0,,EUR,False,Kafka. MySQL. Airflow.,Помогать data scientist-ам с продакшн кодом. Налаживать инфраструктуру и выполнять отдельные небольшие задачи. Погружаться в архитектуру проекта и активно...
69711589,Python developer,Казань,Открытая,2022-09-12T12:54:50+0300,2022-09-12T12:54:50+0300,False,https://api.hh.ru/vacancies/69711589?host=hh.ru,https://hh.ru/vacancy/69711589,INSITECH Development,,,,,"Опыт разработки на <highlighttext>Python</highlighttext> от 3-х лет. Опыт работы с легаси на Django, DRF, FastAPI. Умение писать асинхронный код...",Топовое железо и доп. комплектующие по запросу.
67053710,Разработчик алгоритмов компьютерного зрения в команду Видео,Санкт-Петербург,Открытая,2022-09-09T14:46:12+0300,2022-09-09T14:46:12+0300,False,https://api.hh.ru/vacancies/67053710?host=hh.ru,https://hh.ru/vacancy/67053710,VK,,,,,Знание Java/C++. Опыт вывода ML решений в продакшн и развертывания DL моделей на мобильных платформах.,Решать задачи с помощью классических CV подходов и алгоритмов глубокого обучения. Участвовать в развертывании CV решений на различных платформах совместно...
69705612,Python Team Lead,Москва,Открытая,2022-09-12T11:27:38+0300,2022-09-12T11:27:38+0300,False,https://api.hh.ru/vacancies/69705612?host=hh.ru,https://hh.ru/vacancy/69705612,Т1 Интеграция,,,,,Опыт построения и понимание процессов команды разработки. Опыт работы с другими фреймворками <highlighttext>Python</highlighttext>. Опыт работы с фреймворками FrontEnd (ReactJS). ,"Управление командой разработчиков. Проектирование сервисов со сложной бизнес логикой. Разработка сервисов хранения, обработки данных различной сложности. Разработка сервисов сбора данных..."
69711587,Python developer,Москва,Открытая,2022-09-12T12:54:50+0300,2022-09-12T12:54:50+0300,False,https://api.hh.ru/vacancies/69711587?host=hh.ru,https://hh.ru/vacancy/69711587,INSITECH Development,,,,,"Опыт разработки на <highlighttext>Python</highlighttext> от 3-х лет. Опыт работы с легаси на Django, DRF, FastAPI. Умение писать асинхронный код...",Топовое железо и доп. комплектующие по запросу.
69900006,Senior/Lead Python-разработчик,Москва,Открытая,2022-09-16T14:50:08+0300,2022-09-16T14:50:08+0300,False,https://api.hh.ru/vacancies/69900006?host=hh.ru,https://hh.ru/vacancy/69900006,Контур,,,,,"Опыт коммерческой разработки, работы с высоконагруженными системами. Круто, если вы умеете проектировать быстрые решения и запускать их в сжатые сроки. ","Задачи с высоким уровнем ответственности: предстоит проектировать архитектуру, реализовывать бизнес-логику, самостоятельно принимать решения, запускать сервисы с необходимым уровнем качества. "
67825460,Python разработчик (Цифровой ассистент Робот Макс),Москва,Открытая,2022-09-07T15:16:01+0300,2022-09-07T15:16:01+0300,False,https://api.hh.ru/vacancies/67825460?host=hh.ru,https://hh.ru/vacancy/67825460,РТ Лабс,,,,,"Опыт работы на должности разработчика от 3 лет. Технологический стэк: <highlighttext>Python</highlighttext> 3+, asyncio, SQL (диалект Postgres). Опыт использования ORM...","Работать над микросервисами в agile-команде (PO, аналитик, разработчики и тестировщики). Создавать технические решения по бизнес-задачам вместе с командой. "
69694383,Python-разработчик,Казань,Открытая,2022-09-12T08:54:48+0300,2022-09-12T08:54:48+0300,False,https://api.hh.ru/vacancies/69694383?host=hh.ru,https://hh.ru/vacancy/69694383,MST,,175000.0,RUR,False,"Опыт работы с <highlighttext>Python</highlighttext>, Django + DRF или другим фреймворком от 4-х лет, WSGI, ASGI. Опыт работы в Linux...","Разрабатывать новый сложный функционал, поддерживать и оптимизировать старый. Управлять командой разработки и самостоятельно распределять задачи внутри команды. Проводить CodeReview. "
69772953,Senior Python developer (MLOps),Батуми,Открытая,2022-09-13T16:43:12+0300,2022-09-13T16:43:12+0300,False,https://api.hh.ru/vacancies/69772953?host=hh.ru,https://hh.ru/vacancy/69772953,Wisebits,3500.0,,EUR,False,Kafka. MySQL. Airflow.,Помогать data scientist-ам с продакшн кодом. Налаживать инфраструктуру и выполнять отдельные небольшие задачи. Погружаться в архитектуру проекта и активно...
69894410,TeamLead / руководитель команды разработки (Python),Москва,Открытая,2022-09-16T13:13:40+0300,2022-09-16T13:13:40+0300,False,https://api.hh.ru/vacancies/69894410?host=hh.ru,https://hh.ru/vacancy/69894410,Х5 Group,,,,,Опыт управления командой. Хорошие знания <highlighttext>Python</highlighttext> (3.Х). Знания веб-фреймворков – синхронные и асинхронные (aiohttp или fastapi). Опыт работы с...,"Управление командой 5+ человек разработчиков различного уровня. Ресурсный менеджмент (найм, адаптация, развитие разработчиков). Постановка и декомпозиция задач, контроль результатов. "
69711590,Python developer,Екатеринбург,Открытая,2022-09-12T12:54:50+0300,2022-09-12T12:54:50+0300,False,https://api.hh.ru/vacancies/69711590?host=hh.ru,https://hh.ru/vacancy/69711590,INSITECH Development,,,,,"Опыт разработки на <highlighttext>Python</highlighttext> от 3-х лет. Опыт работы с легаси на Django, DRF, FastAPI. Умение писать асинхронный код...",Топовое железо и доп. комплектующие по запросу.
69592336,Разработчик backend PostgreSQL+Python,Санкт-Петербург,Открытая,2022-09-07T18:26:07+0300,2022-09-07T18:26:07+0300,False,https://api.hh.ru/vacancies/69592336?host=hh.ru,https://hh.ru/vacancy/69592336,ВеллДан софт,,200000.0,RUR,True,"Понимание плюсов и минусов и особенностей использования хранимых процедур на SQL, PL/SQL и PL/<highlighttext>Python</highlighttext>. Опыт работы с RabbitMQ...",Оптимизация запросов в хранимых процедурах. Разработка сервисов на <highlighttext>Python</highlighttext> 3. Анализ причин сбоев и/или снижения производительности. Развертывание изменений в...
68829981,Team Lead/Senior Python Developer (remote),Москва,Открытая,2022-09-13T14:36:05+0300,2022-09-13T14:36:05+0300,False,https://api.hh.ru/vacancies/68829981?host=hh.ru,https://hh.ru/vacancy/68829981,BestDoctor,300000.0,,RUR,False,"Опыт коммерческой разработки на <highlighttext>Python</highlighttext> от 3 лет, хорошее знание самого языка, умение работать с Django или аналогичным веб-фреймворком...","Ядро: ключевая архитектура и API нашей айти-инфраструктуры. Пользовательская разработка: мобильное приложение, веб-кабинеты, API для внешних интеграций. "
