id,name,area,type,published_at,created_at,archived,url,alternate_url,employer,from,to,currency,gross,requirement,responsibility
70763278,DevOps Engineer (удаленная работа),Москва,Открытая,2022-10-04T16:37:07+0300,2022-10-04T16:37:07+0300,False,https://api.hh.ru/vacancies/70763278?host=hh.ru,https://hh.ru/vacancy/70763278,РОСБАНК,,,,,"Опыт работы с системами управлением конфигурациями (Ansible). Знание SQL и/или одного из скриптовых языков разработки Bash, PowerShell, <highlighttext>Python</highlighttext>.","Определение и внедрение методологии, стандартов и инженерных практик DevOps. Внедрение, развитие и сопровождение инструментов DevOps. Обучение инструментам и инженерным практикам..."
70856894,Machine learning engineer Middle+,Екатеринбург,Открытая,2022-10-06T14:01:34+0300,2022-10-06T14:01:34+0300,False,https://api.hh.ru/vacancies/70856894?host=hh.ru,https://hh.ru/vacancy/70856894,Северный Центр Позитроники,,,,,"2+ лет опыта разработки в компьютерном зрении. 0,5-1+ лет опыта с генеративными сетями (GAN, Variational Autoencoders...","Дизайн, разработка дискриминативных и генеративных нейронных сетей. Серверное обучение нейронных сетей. Оптимизация нейронных сетей. Работа с данными. Развертывание нейронных сетей..."
69631520,Java Developer (Server side),Москва,Открытая,2022-10-05T16:34:58+0300,2022-10-05T16:34:58+0300,False,https://api.hh.ru/vacancies/69631520?host=hh.ru,https://hh.ru/vacancy/69631520,Мобайл Дата Хаус,170000.0,180000.0,RUR,False,"Плюсом будет, если у кандидата есть: Знание языков Go, Node JS, <highlighttext>Python</highlighttext> (Flask). Знание Redis (в качестве кэша, key-value...",
70793278,Devops инженер,Москва,Открытая,2022-10-05T10:21:00+0300,2022-10-05T10:21:00+0300,False,https://api.hh.ru/vacancies/70793278?host=hh.ru,https://hh.ru/vacancy/70793278,Лига Цифровой Экономики,,,,,Уверенные знания и опыт работы с системами оркестрации контейнеров (OpenShift/Kubernetes). Скриптинг (bash/<highlighttext>python</highlighttext>) уверенное использование. Знание и понимания методологии...,"Проект для крупного заказчика. В рамках проекта, создается информационно-аналитическая подсистема, консолидирующая актуальные данные компонентов микросервисной автоматизированной системы. "
70765670,Инженер-разработчик С++ (машинное зрение),Санкт-Петербург,Открытая,2022-10-04T17:25:33+0300,2022-10-04T17:25:33+0300,False,https://api.hh.ru/vacancies/70765670?host=hh.ru,https://hh.ru/vacancy/70765670,ПРОФ-ИТ ГРУПП,,,,,"Продвинутые навыки программирования на C/С++. Программирование на <highlighttext>Python</highlighttext>. Уверенные знание библиотек STL, QT, Boost (приветствуется). Знание библиотек OpenCV (опыт...",Консалтинг и разработка бизнес-приложений (комплексные решения для автоматизации бизнес-процессов предприятий и организаций из различных отраслей экономики). 
69956567,Senior blockchain developer,Санкт-Петербург,Открытая,2022-10-04T11:06:41+0300,2022-10-04T11:06:41+0300,False,https://api.hh.ru/vacancies/69956567?host=hh.ru,https://hh.ru/vacancy/69956567,Redsteep,300000.0,450000.0,RUR,True,"Приносить измеримую пользу заказчикам. Видеть проблемы глазами бизнеса, предлагать наши решения. Желателен опыт работы с Blockchain, в основном EVM-like...",Находить красивые и эффективные решения в коде. Примеры проектов: выпуск токенов и NFT; проект по интеграции play-to-earn механик...
46679386,DilOS (illumos based) developer,Москва,Открытая,2022-10-04T15:29:46+0300,2022-10-04T15:29:46+0300,False,https://api.hh.ru/vacancies/46679386?host=hh.ru,https://hh.ru/vacancy/46679386,Арго Технолоджи Ист,,,,,"Умение разобраться в чужом коде (в том числе perl, <highlighttext>python</highlighttext>, bash, Makefile, nodeJS и т.д.). Работа в среде UNIX...",Портирование приложений (DEB-пакетов) на платформу DilOS (illumos) (C/C++ и т.д.) из Debian upstream. Отладка приложения в среде...
70822694,Разработчик BI,Москва,Открытая,2022-10-05T17:58:47+0300,2022-10-05T17:58:47+0300,False,https://api.hh.ru/vacancies/70822694?host=hh.ru,https://hh.ru/vacancy/70822694,Ак Барс Цифровые Технологии,,,,,Опыт работы BI-аналитиком/разработчиком BI от 2 лет. Желательные: Навыки работы с <highlighttext>Python</highlighttext>. Опыт построения предиктивной аналитики. ,Мы в поисках инициативного разработчика BI для разработки приложений по анализу бизнес-метрик на Qlik Sense. Проактивная позиция в работе...
70765615,Инженер-разработчик С++ (машинное зрение),Казань,Открытая,2022-10-04T17:23:44+0300,2022-10-04T17:23:44+0300,False,https://api.hh.ru/vacancies/70765615?host=hh.ru,https://hh.ru/vacancy/70765615,ПРОФ-ИТ ГРУПП,,,,,"Продвинутые навыки программирования на C/С++. Программирование на <highlighttext>Python</highlighttext>. Уверенные знание библиотек STL, QT, Boost (приветствуется). Знание библиотек OpenCV (опыт...",Консалтинг и разработка бизнес-приложений (комплексные решения для автоматизации бизнес-процессов предприятий и организаций из различных отраслей экономики). 
70822706,Разработчик BI,Санкт-Петербург,Открытая,2022-10-05T17:59:07+0300,2022-10-05T17:59:07+0300,False,https://api.hh.ru/vacancies/70822706?host=hh.ru,https://hh.ru/vacancy/70822706,Ак Барс Цифровые Технологии,,,,,Опыт работы BI-аналитиком/разработчиком BI от 2 лет. Желательные: Навыки работы с <highlighttext>Python</highlighttext>. Опыт построения предиктивной аналитики. ,Мы в поисках инициативного разработчика BI для разработки приложений по анализу бизнес-метрик на Qlik Sense. Проактивная позиция в работе...
68450154,Программист PHP / Разработчик,Черноголовка,Открытая,2022-10-05T18:10:15+0300,2022-10-05T18:10:15+0300,False,https://api.hh.ru/vacancies/68450154?host=hh.ru,https://hh.ru/vacancy/68450154,АЙТИ-БАЛАНС,170000.0,,RUR,False,"Опыт работы с БД (PostgreSQL). PHP 7 и выше, JS. Хорошее понимание ООП. Знание Linux приветствуется. Знание фреймворков: Zend framework...","Расширение функционала для федеральных и коммерческих ЭТП (Zend, ExtJS, ExtReact). Рефакторинг. Написание новых сервисов для ЭТП (Symfony, VueJS, ReactJS, <highlighttext>Python</highlighttext>) . "
70743371,Senior Server Developer,Краснодар,Открытая,2022-10-04T12:02:15+0300,2022-10-04T12:02:15+0300,False,https://api.hh.ru/vacancies/70743371?host=hh.ru,https://hh.ru/vacancy/70743371,Delta Vision Games,,,,,"Опыт сетевой разработки игр с синхронным мультиплеером. Опыт асинхронного программирования (использование <highlighttext>Python</highlighttext> библиотеки asyncio, короутин в Lua и т.д.). ","Разработка серверной части многопользовательской игры - стратегии реального времени, а также сетевой части игрового клиента. Участие в планировании итераций разработки проекта..."
69188284,PHP developer (remote),Москва,Открытая,2022-10-06T19:09:35+0300,2022-10-06T19:09:35+0300,False,https://api.hh.ru/vacancies/69188284?host=hh.ru,https://hh.ru/vacancy/69188284,modesco,150000.0,230000.0,RUR,False,Имеешь опыт разработки на PHP от 3-х лет и хорошо понимаешь его возможности. Умеешь писать и оптимизировать сложные SQL...,Оптимизация компонентов под высокие нагрузки. Интеграции с внешними сервисами. Кодишь на <highlighttext>python</highlighttext> (у нас есть бот на питоне). 
70822654,Разработчик BI,Казань,Открытая,2022-10-05T17:57:17+0300,2022-10-05T17:57:17+0300,False,https://api.hh.ru/vacancies/70822654?host=hh.ru,https://hh.ru/vacancy/70822654,Ак Барс Цифровые Технологии,,,,,Опыт работы BI-аналитиком/разработчиком BI от 2 лет. Желательные: Навыки работы с <highlighttext>Python</highlighttext>. Опыт построения предиктивной аналитики. ,Мы в поисках инициативного разработчика BI для разработки приложений по анализу бизнес-метрик на Qlik Sense. Проактивная позиция в работе...
70817034,"Руководитель группы разработки, Tech Lead команды (MTS AI)",Москва,Открытая,2022-10-05T16:09:55+0300,2022-10-05T16:09:55+0300,False,https://api.hh.ru/vacancies/70817034?host=hh.ru,https://hh.ru/vacancy/70817034,МТС,,,,,"Опыт разработчиком ПО - не менее 6 лет. Хорошие практические знания технологий - <highlighttext>python</highlighttext>, linux, microservices, docker, kubernetes. Опыт руководства кросс-функцианальными...","Формирует backlog продукта, планирование и приоритеризацию задач. Выполняет итеративный дизайн архитектуры продукта и компонентов, определяя оптимальный технологический стек и системный..."
70755430,DevOps - специалист,Москва,Открытая,2022-10-04T14:51:56+0300,2022-10-04T14:51:56+0300,False,https://api.hh.ru/vacancies/70755430?host=hh.ru,https://hh.ru/vacancy/70755430,БФТ-Холдинг (Бюджетные и Финансовые Технологии),,,,,"Знания и опыт работы с системами IaaS (Ansible, Terraform). Знание скриптовых языков (bash, <highlighttext>python</highlighttext>). Опыт работы в распределённой команде. ",Более 100 тыс. внутренних пользователей. Более 50 млн. внешних пользователей. Централизованная микро-сервисная архитектура. Событийная модель работы с данными. 
69962147,Senior DevOps Engineer (Serbia),Москва,Открытая,2022-10-04T12:08:46+0300,2022-10-04T12:08:46+0300,False,https://api.hh.ru/vacancies/69962147?host=hh.ru,https://hh.ru/vacancy/69962147,Schaffhausen Institute of Technology,,,,,"Excellent in-depth knowledge of Linux, console, bash, performance analysis and troubleshooting. Solid experience in administrating application servers, web servers...","Delivering a reliable and scalable cloud-based educational Software-as-a-Service to our customers. Designing automation, monitoring, deployment, configuration..."
70788880,DevOps Engineer,Новосибирск,Открытая,2022-10-05T09:21:12+0300,2022-10-05T09:21:12+0300,False,https://api.hh.ru/vacancies/70788880?host=hh.ru,https://hh.ru/vacancy/70788880,LC Group,,,,,Умение писать скрипты на PowerShell/bash/<highlighttext>python</highlighttext>/groovy. Опыт разработки ПО. Опыт разработки на golang. Опыт работы с Docker Swarm. ,"Построение CI/CD-процессов для различных типов сред (dev, staging, production, etc). Построение CT-процессов (авто-тесты - nunit, specflow, cypress..."
70027567,"Руководитель группы разработки, Tech Lead команды Audiogram (MTS AI)",Москва,Открытая,2022-10-04T21:28:20+0300,2022-10-04T21:28:20+0300,False,https://api.hh.ru/vacancies/70027567?host=hh.ru,https://hh.ru/vacancy/70027567,МТС,,,,,"Опыт разработчиком ПО - не менее 6 лет. Хорошие практические знания технологий - <highlighttext>python</highlighttext>, linux, microservices, docker, kubernetes. Опыт руководства кросс-функцианальными...","Формирует backlog продукта, планирование и приоритеризацию задач. Выполняет итеративный дизайн архитектуры продукта и компонентов, определяя оптимальный технологический стек и системный..."
47300910,Golang Developer,Москва,Открытая,2022-10-06T12:35:12+0300,2022-10-06T12:35:12+0300,False,https://api.hh.ru/vacancies/47300910?host=hh.ru,https://hh.ru/vacancy/47300910,WILDBERRIES,,,,,"Опыт работы с базами данных: MSSQL, Postgresql, NoSQL. Опыт в back-end технологиях – Golang, C#, Java, <highlighttext>Python</highlighttext>. Docker и Kubernetes. ","14 стран присутствия и более 115 тыс. пунктов выдачи заказов. 43 млн клиентов и более 1,5 млн ежедневных заказов. "
70133288,Backend разработчик Node.js,Москва,Открытая,2022-10-04T07:57:42+0300,2022-10-04T07:57:42+0300,False,https://api.hh.ru/vacancies/70133288?host=hh.ru,https://hh.ru/vacancy/70133288,Р-Вижн,,,,,Опыт работы с Docker. Имеешь опыт в администрировании. Работал с <highlighttext>Python</highlighttext>. Знаешь Active Directory. Понимаешь принцип работы стека TCP/IP.,Работа над движком (Node.js) программной системы R-Vision (централизованной системы мониторинга и управления информационной безопасностью). Решение нестандартных / сложных технических задач...
69833638,Программист (Laravel),Москва,Открытая,2022-10-06T06:58:49+0300,2022-10-06T06:58:49+0300,False,https://api.hh.ru/vacancies/69833638?host=hh.ru,https://hh.ru/vacancy/69833638,Кофман Леонид Борисович,20000.0,40000.0,RUR,False,"Laravel 5.2, желательно с пониманием модели многопоточной работы. Bootstrap. JS. MySQL. ООП. Знания <highlighttext>Python</highlighttext> будут дополнительным плюсом. ",
70761247,"Lead / Senior C# разработчик (.net, back-end)",Москва,Открытая,2022-10-04T16:10:06+0300,2022-10-04T16:10:06+0300,False,https://api.hh.ru/vacancies/70761247?host=hh.ru,https://hh.ru/vacancy/70761247,Mindbox,,400000.0,RUR,False,,"Net6 и k8s везде. Монолит рефакторится, 20 000 тестов, покрытие хорошее. Пятнадцать лет Agile, CI/CD с..."
68855007,PHP Backend developer,Санкт-Петербург,Открытая,2022-10-06T18:33:57+0300,2022-10-06T18:33:57+0300,False,https://api.hh.ru/vacancies/68855007?host=hh.ru,https://hh.ru/vacancy/68855007,Ленинград Медиа,200000.0,,RUR,False,...MySQL / PostgreSQL и т.п.). Знакомство с VueJS. Опыт FullStack разработки. Опыт работы с highload. Знание предметной области. Знание <highlighttext>Python</highlighttext>.,"Принимать участие в проектировании и реализации портала stavka.tv. Заниматься рефакторингом существующей кодовой базы. Плотно взаимодействовать с командой, состоящей из бэкендеров..."
69525369,Эксперт по автоматизации обработки неструктурированной информации,Москва,Открытая,2022-10-04T16:30:29+0300,2022-10-04T16:30:29+0300,False,https://api.hh.ru/vacancies/69525369?host=hh.ru,https://hh.ru/vacancy/69525369,Консист-ОС,,,,,"Опыт написания скриптов LUA, <highlighttext>Python</highlighttext>. Опыт JAVA-разработки. Опыт настройки систем распознавания сканированных образов Finereader, ABBYY OCR и т.п.",Поддержка функционирования систем сбора и анализа неструктурированных данных на основе Microfocus IDOL. Регламентное техническое обслуживание серверов обработки неструктурированных данных. 
70743583,Разработчик Android (Java),Москва,Открытая,2022-10-04T12:05:27+0300,2022-10-04T12:05:27+0300,False,https://api.hh.ru/vacancies/70743583?host=hh.ru,https://hh.ru/vacancy/70743583,Первый Бит,200000.0,300000.0,RUR,True,"Знание языков программирования: Java. Опыт разработки мобильных приложений для Android. Навыки решать задачи связанные с. Обменами (TCP/IP, AMQP, HTTP). ",Разработка android приложения для интеграции мобильного приложения 1С с другими системами через RabbitMQ (Java). Разработка внешних компонент 1С...
69089392,ETL Разработчик-Консультант,Москва,Открытая,2022-10-06T12:18:21+0300,2022-10-06T12:18:21+0300,False,https://api.hh.ru/vacancies/69089392?host=hh.ru,https://hh.ru/vacancy/69089392,Bell Integrator,,,,,Навыки программирования на Java/<highlighttext>Python</highlighttext>. Опыт программирования и разработки алгоритмов и структур данных. Фундаментальные знания принципов построения распределенных систем хранения...,"Команда платформы консолидирует данные из различных внешних и внутренних источников, запускает пилотные проекты и обогащает данными в соответствии с требованиями..."
68971422,Lead Data Engineer,Санкт-Петербург,Открытая,2022-10-05T15:24:32+0300,2022-10-05T15:24:32+0300,False,https://api.hh.ru/vacancies/68971422?host=hh.ru,https://hh.ru/vacancy/68971422,Приложение «Кошелёк»,,,,,"Опыт коммерческой разработки (предпочтительно <highlighttext>Python</highlighttext> и Java). Опыт работы с потоками данных и их загрузкой (ETL, батчи, потоковая обработка). ","2) ETL/ELT. Управление потоками данных, наполнение Data Lake и DWH, создание витрин и подобное. Для этого используются Airflow и..."
70810605,"Инженер по автоматизации тестирования, Golang, back-end, Ozon Bank",Екатеринбург,Открытая,2022-10-05T14:23:20+0300,2022-10-05T14:23:20+0300,False,https://api.hh.ru/vacancies/70810605?host=hh.ru,https://hh.ru/vacancy/70810605,Ozon,,,,,Знаете и понимаете основные принципы тестирования и автоматизации. Обладаете опытом тестирования и автоматизации на backend/API с базой данных.,"Мы обеспечиваем продукты финтеха Ozon автотестами и утилитами, помогающими в тестировании. У нас есть несколько команд, каждая из которых отвечает..."
69145473,Senior Backend-разработчик C/Go,Москва,Открытая,2022-10-05T16:14:06+0300,2022-10-05T16:14:06+0300,False,https://api.hh.ru/vacancies/69145473?host=hh.ru,https://hh.ru/vacancy/69145473,Rambler&Co,,,,,"Отличные знания C. Базовые знания <highlighttext>Python</highlighttext> и С++ (на уровне ""C с классами""). Желательно знакомство с Go или готовность его...",Разрабатывать новые микросервисы на Go. Поддерживать и улучшать уже имеющиеся сервисы (Go/C/C++). Принимать активное участие в code review. 
69380620,Разработчик облачного хранилища (Go),Москва,Открытая,2022-10-04T13:26:46+0300,2022-10-04T13:26:46+0300,False,https://api.hh.ru/vacancies/69380620?host=hh.ru,https://hh.ru/vacancy/69380620,МойОфис,,,,,Понимание проблематики распределённых систем. Понимание архитектуры scale-out хранилищ. Опыт серверной разработки от 3 лет. Опыт разработки на Go от...,Проектирование архитектуры и реализация компонентов облачного хранилища. Покрытие кода тестами различных уровней. Поиск и решение проблем производительности. Развитие систем сбора...
70807448,Site Reliability Engineer (SRE) / Software Engineer,Москва,Открытая,2022-10-05T13:38:30+0300,2022-10-05T13:38:30+0300,False,https://api.hh.ru/vacancies/70807448?host=hh.ru,https://hh.ru/vacancy/70807448,Tabby,,,,,"Can read and understand HTML, JS, TypeScript, <highlighttext>Python</highlighttext>, Shell/Bash. Have experience with SLO/Error Budget. Able for using API...",Infrastructure automation with Terraform. Improving monitoring and tuning alerts in DataDog as well as new metrics development. Interaction with product...
70504144,Unity Developer,Москва,Открытая,2022-10-05T10:02:17+0300,2022-10-05T10:02:17+0300,False,https://api.hh.ru/vacancies/70504144?host=hh.ru,https://hh.ru/vacancy/70504144,3Д-РАЗРАБОТКА,100000.0,,RUR,False,"Отличное владение C#. - Понимание работы 3D пайплайна ( построение 3D геометрии , шейдеры, материалы, оптимизация). Приветствуется : Знание Javascript, написание нативных...","Работа с клиент-серверными архитектурами ( REST,WebSocket, Photon, SignaIR). - Написание managed и нативных плагинов на Unity ( в частности под Android)."
