id,name,area,type,published_at,created_at,archived,url,alternate_url,employer,from,to,currency,gross,requirement,responsibility
69543162,Data Engineer,Москва,Открытая,2022-09-28T16:22:25+0300,2022-09-28T16:22:25+0300,False,https://api.hh.ru/vacancies/69543162?host=hh.ru,https://hh.ru/vacancy/69543162,Ростелеком,,,,,Навыки использования оркестратора Dagster/Airflow. Уверенное владение <highlighttext>Python</highlighttext> в части обработки данных и ETL. Желание разбираться в бизнес-особенностях данных...,"Проектированием и реализацией моделей данных, исходя из бизнес-требований. Выстраиванием интеграций с различными источниками и ETL процессов. Документировать и поддерживать..."
70470526,Разработчик DWH,Москва,Открытая,2022-09-28T14:20:50+0300,2022-09-28T14:20:50+0300,False,https://api.hh.ru/vacancies/70470526?host=hh.ru,https://hh.ru/vacancy/70470526,"Ренессанс cтрахование, Группа",,,,,"Знает подходы проектирования DWH - Data Vault. Знает SQL-запросы, AirFlow, <highlighttext>Python</highlighttext>. Умеет работать с Confluence, Jira, Visual Paradigm. ",Разрабатывать и развивать ИТ-решения для КХД. Разрабатывать техническую и проектную документации для КХД. Формировать изменения схем моделей данных КХД. 
67780398,"Старший разработчик Golang (Marketing Communication Platform, Путь совершения покупки)",Москва,Открытая,2022-09-28T13:11:21+0300,2022-09-28T13:11:21+0300,False,https://api.hh.ru/vacancies/67780398?host=hh.ru,https://hh.ru/vacancy/67780398,Ozon,,,,,"Опыт коммерческой разработки на GO от 2 лет. Владение языком C++, Java, C#, <highlighttext>Python</highlighttext>, PHP, Ruby и т.п. - ","Участвовать в разработке архитектурных решений. Писать качественный, высокопроизводительный код на Go. Изучить существующие микросервисы Ozon и встроиться в них."
70168494,Системный инженер-программист С/С++,Омск,Открытая,2022-09-28T09:00:36+0300,2022-09-28T09:00:36+0300,False,https://api.hh.ru/vacancies/70168494?host=hh.ru,https://hh.ru/vacancy/70168494,Прософт-Системы,,,,,Опыт разработки сетевых и многопоточных приложений. Опыт написания скриптов на Bash/<highlighttext>Python</highlighttext>. Опыт работы с системой контроля версий Git (GitLab). ,Разработка и сопровождение ПО на С/С++ под QNX/Linux. Разработка и сопровождение ПО микроконтроллеров.
69351753,Middle Node.JS-developer (remote),Воронеж,Открытая,2022-09-28T14:32:04+0300,2022-09-28T14:32:04+0300,False,https://api.hh.ru/vacancies/69351753?host=hh.ru,https://hh.ru/vacancy/69351753,SoftGamings,150000.0,250000.0,RUR,False,"...позиции программиста на любом из следующих языков программирования: php, java, <highlighttext>python</highlighttext>, golang и им подобным. Понимают и умеют применять принципы...","Разработкой web-приложений с использованием Nest, Postgres, RabbitMQ и т.д.. Решением интересных и нестандартных задач. Работой с highload-проектом. "
70168665,Инженер-программист С++ (проект REGUL),Санкт-Петербург,Открытая,2022-09-28T09:00:36+0300,2022-09-28T09:00:36+0300,False,https://api.hh.ru/vacancies/70168665?host=hh.ru,https://hh.ru/vacancy/70168665,Прософт-Системы,,,,,Глубокое знание С/С++. Знание стандартных механизмов операционных систем. Знание основ эффективной разработки высоконадежных кроссплатформенных приложений. Знание шаблонов проектирования. ,"Разработка и сопровождение микросервисов контроллера. Разработка и сопровождение драйверов для устройств. Разработка/сопровождение драйверов промышленных протоколов обмена данными (ModBus, IEC..."
50161810,Системный инженер-программист С/С++,Екатеринбург,Открытая,2022-09-28T09:00:35+0300,2022-09-28T09:00:35+0300,False,https://api.hh.ru/vacancies/50161810?host=hh.ru,https://hh.ru/vacancy/50161810,Прософт-Системы,,,,,Опыт разработки сетевых и многопоточных приложений. Опыт написания скриптов на Bash/<highlighttext>Python</highlighttext>. Опыт работы с системой контроля версий Git (GitLab). ,Разработка и сопровождение ПО на С/С++ под QNX/Linux. Разработка и сопровождение ПО микроконтроллеров.
70168493,Системный инженер-программист С/С++,Томск,Открытая,2022-09-28T09:00:36+0300,2022-09-28T09:00:36+0300,False,https://api.hh.ru/vacancies/70168493?host=hh.ru,https://hh.ru/vacancy/70168493,Прософт-Системы,,,,,Опыт разработки сетевых и многопоточных приложений. Опыт написания скриптов на Bash/<highlighttext>Python</highlighttext>. Опыт работы с системой контроля версий Git (GitLab). ,Разработка и сопровождение ПО на С/С++ под QNX/Linux. Разработка и сопровождение ПО микроконтроллеров.
70168662,Инженер-программист С++ (проект REGUL),Омск,Открытая,2022-09-28T09:00:36+0300,2022-09-28T09:00:36+0300,False,https://api.hh.ru/vacancies/70168662?host=hh.ru,https://hh.ru/vacancy/70168662,Прософт-Системы,,,,,Глубокое знание С/С++. Знание стандартных механизмов операционных систем. Знание основ эффективной разработки высоконадежных кроссплатформенных приложений. Знание шаблонов проектирования. ,"Разработка и сопровождение микросервисов контроллера. Разработка и сопровождение драйверов для устройств. Разработка/сопровождение драйверов промышленных протоколов обмена данными (ModBus, IEC..."
55574051,Инженер-программист С++ (проект REGUL),Екатеринбург,Открытая,2022-09-28T09:00:35+0300,2022-09-28T09:00:35+0300,False,https://api.hh.ru/vacancies/55574051?host=hh.ru,https://hh.ru/vacancy/55574051,Прософт-Системы,,,,,Глубокое знание С/С++. Знание стандартных механизмов операционных систем. Знание основ эффективной разработки высоконадежных кроссплатформенных приложений. Знание шаблонов проектирования. ,"Разработка и сопровождение микросервисов контроллера. Разработка и сопровождение драйверов для устройств. Разработка/сопровождение драйверов промышленных протоколов обмена данными (ModBus, IEC..."
70168663,Инженер-программист С++ (проект REGUL),Нижний Новгород,Открытая,2022-09-28T09:00:36+0300,2022-09-28T09:00:36+0300,False,https://api.hh.ru/vacancies/70168663?host=hh.ru,https://hh.ru/vacancy/70168663,Прософт-Системы,,,,,Глубокое знание С/С++. Знание стандартных механизмов операционных систем. Знание основ эффективной разработки высоконадежных кроссплатформенных приложений. Знание шаблонов проектирования. ,"Разработка и сопровождение микросервисов контроллера. Разработка и сопровождение драйверов для устройств. Разработка/сопровождение драйверов промышленных протоколов обмена данными (ModBus, IEC..."
70457271,Программист 1С (Junior),Москва,Открытая,2022-09-28T11:04:37+0300,2022-09-28T11:04:37+0300,False,https://api.hh.ru/vacancies/70457271?host=hh.ru,https://hh.ru/vacancy/70457271,Бюро 1440,,,,,"Опыт администрирование Postgres. Опыт разработки на 1С. Понимание работы сетей. Знакомство с git. Знание сторонних языков программирования <highlighttext>Python</highlighttext>, 1...","Поддержка баз ERP, ЗУП, ДО. Консультирование пользователей. Администрирование серверов 1С. Администрирование баз данных (Postgres). Администрирование пользователей информационных баз. "
70430179,Golang-разработчик (команда авторизации Почты),Москва,Открытая,2022-09-27T21:57:25+0300,2022-09-27T21:57:25+0300,False,https://api.hh.ru/vacancies/70430179?host=hh.ru,https://hh.ru/vacancy/70430179,VK,,,,,"Будет плюсом: Хорошее знание Linux, терминала и вспомогательных утилит (grep, awk). Владение любым скриптовым языком (<highlighttext>Python</highlighttext>/Lua). Опыт работы с...","Авторизация Почты Mail.ru — ключевой инфраструктурный компонент Почты, обеспечивающий безопасность пользователя и его данных. Стек разработки: C, Go, Tarantool, Kubernetes, Kafka. "
70426401,DevOps Engineer,Москва,Открытая,2022-09-27T17:27:00+0300,2022-09-27T17:27:00+0300,False,https://api.hh.ru/vacancies/70426401?host=hh.ru,https://hh.ru/vacancy/70426401,ИЦ АЙ-ТЕКО,,,,,"Понимание технологий OpenShift, OpenStack. Опыт работы с Ansible, базами данных, CI/CD gitlab/teamcity/jenkins, Kubernetes. Навыки работы с <highlighttext>Python</highlighttext>...",
70423871,ETL-разработчик в команду эмуляции данных,Москва,Открытая,2022-09-27T16:32:55+0300,2022-09-27T16:32:55+0300,False,https://api.hh.ru/vacancies/70423871?host=hh.ru,https://hh.ru/vacancy/70423871,Райффайзен Банк,,,,,"Знание ООП, промышленный опыт работы с <highlighttext>Python</highlighttext>/Java. Понимание REST и опыт работы с серверными приложениями. Желателен опыт DevOps, понимание...",Проектировать и разрабатывать процессы загрузки данных (ETL/ELT). Оптимизировать нагрузку и время выполнения пайплайнов. Обеспечивать мониторинг процессов и проверки качества...
70431076,Full-stack developer,Таганрог,Открытая,2022-09-27T20:29:30+0300,2022-09-27T20:29:30+0300,False,https://api.hh.ru/vacancies/70431076?host=hh.ru,https://hh.ru/vacancy/70431076,ВС Кэпитал,3500.0,,USD,False,"Знает JavaScript (React) и Java (желательно) или другие серверные языки (<highlighttext>Python</highlighttext>, C++). Умеет работать с базами данных: MongoDB, PostgreSQL, MySQL.","Участие в разработке сервиса, который помогает продавцам на Amazon увеличить свои продажи). Хочет развиваться и изучает или планирует изучать другие..."
70406313,Unreal Engine Developer (Remote),Москва,Открытая,2022-09-27T12:21:52+0300,2022-09-27T12:21:52+0300,False,https://api.hh.ru/vacancies/70406313?host=hh.ru,https://hh.ru/vacancy/70406313,ICVR,,,,,"Выпущенные игровые проекты на Unreal Engine. - Хорошее знание С++, Blueprints, <highlighttext>Python</highlighttext>, опыт разработки с использованием Qt фреймворка. - Опыт управления командой...","Создавать AAA проекты на платформе Unreal. - Обеспечивать стабильность и качество разработки игр, качество архитектуры и кода. - Развивать и улучшать имеющиеся..."
70423106,Mobile Developer (React Native),Москва,Открытая,2022-09-27T16:19:53+0300,2022-09-27T16:19:53+0300,False,https://api.hh.ru/vacancies/70423106?host=hh.ru,https://hh.ru/vacancy/70423106,"Hi, Rockits!",,400000.0,RUR,False,"Понимание работы HTTP API / gRPC. - Понимание архитектурных паттернов проектирования. - Опыт работы с NodeJS, GO, <highlighttext>Python</highlighttext> приветствуется. - Понимание и опыт разработки...",
54721364,Node.js разработчик,Москва,Открытая,2022-09-27T13:21:35+0300,2022-09-27T13:21:35+0300,False,https://api.hh.ru/vacancies/54721364?host=hh.ru,https://hh.ru/vacancy/54721364,ДОМ.РФ,,,,,"Опыт работы с Node.js от 2 лет. Опыт работы с Nest.js (желательно), либо с Express.js. Уверенное знание PostgreSQL. ","Языки программирования: Java, Kotlin, JavaScript, <highlighttext>python</highlighttext>. Используемые СПО: KeyCloak, Gravitee.io, Kafka, minIO, Airflow. Фреймворки, платформы и библиотеки: ReactJS, Redux, Spring..."
54632606,Frontend разработчик (React),Москва,Открытая,2022-09-27T13:21:35+0300,2022-09-27T13:21:35+0300,False,https://api.hh.ru/vacancies/54632606?host=hh.ru,https://hh.ru/vacancy/54632606,ДОМ.РФ,,,,,Изучил React + Redux вдоль и поперек. Командный игрок со своим мнением и инициативой. Любит Unix-системы. Стремится развиваться. ,"Языки программирования: Java, Kotlin, JavaScript, <highlighttext>python</highlighttext>. Используемые СПО: KeyCloak, Gravitee.io, Kafka, minIO, Airflow. Фреймворки, платформы и библиотеки: ReactJS, Redux, Spring..."
69518191,Руководитель направления безопасности кода,Казань,Открытая,2022-09-27T11:29:35+0300,2022-09-27T11:29:35+0300,False,https://api.hh.ru/vacancies/69518191?host=hh.ru,https://hh.ru/vacancy/69518191,Ак Барс Банк,,,,,"Умение читать и разбираться в чужом коде (наш стэк: C#, JS, Swift, Java, <highlighttext>Python</highlighttext>). Знание инструментов анализа приложений SAST/DAST...",Участие в разработке архитектуры новых сервисов формирование технических заданий к проектируемым банковским системам и сервисам в части определения требований безопасности...
70371622,Разработчик DWH,Москва,Открытая,2022-09-26T18:04:21+0300,2022-09-26T18:04:21+0300,False,https://api.hh.ru/vacancies/70371622?host=hh.ru,https://hh.ru/vacancy/70371622,Кадровое агентство Юнити,,340000.0,RUR,False,Опыт работы с реляционными базами данных. Знание SQL и <highlighttext>Python</highlighttext> на хорошем уровне. Понимание ETL/ELT процессов. Чтение плана выполнения...,"Проект HR хранилище. Разработка на PostgreSQL, построение визуализации на Power BI. Разработка хранилища данных. Разработка хранилища по методологии DWH на..."
69746235,Разработчик WEB приложений,Москва,Открытая,2022-09-27T02:40:01+0300,2022-09-27T02:40:01+0300,False,https://api.hh.ru/vacancies/69746235?host=hh.ru,https://hh.ru/vacancy/69746235,Блок Технологий,,,,,"Опыт работы с React, Express или другими современными веб-фреймворками. Владение <highlighttext>Python</highlighttext> или PHP (даже на базовом уровне), опыт full...",
70373518,Fullstack-разработчик,Москва,Открытая,2022-09-26T18:39:10+0300,2022-09-26T18:39:10+0300,False,https://api.hh.ru/vacancies/70373518?host=hh.ru,https://hh.ru/vacancy/70373518,Ventra,,,,,Уверенные знания JavaScript и <highlighttext>Python</highlighttext>. Опыт работы с фреймворками React или Angular \ Flask или Django. Хорошие знания HTML и CSS. ,Разрабатывать и развивать веб-приложения. Обеспечивать взаимодействие с внешними API. Оптимизировать и рефакторить текущие сервисы. Вести техническую документацию.
69278710,Team Lead Devops-платформа,Москва,Открытая,2022-09-26T16:06:59+0300,2022-09-26T16:06:59+0300,False,https://api.hh.ru/vacancies/69278710?host=hh.ru,https://hh.ru/vacancy/69278710,Банк Хоум Кредит,,,,,Навыки автоматизации инфраструктуры с использованием Ansible. Навыки автоматизации и написания инструментов с использованием <highlighttext>Python</highlighttext>/Bash. Опыт написания Jenkins-джобов на...,"Сопровождение и развитие платформы на базе Kubernetes. Система мониторинга Prometheus, AlertManager, Grafana, Thanos. Система логирования Fluent-bit, Graylog. "
70012030,Senior Data Scientist (оценка моделей),Москва,Открытая,2022-09-26T11:22:14+0300,2022-09-26T11:22:14+0300,False,https://api.hh.ru/vacancies/70012030?host=hh.ru,https://hh.ru/vacancy/70012030,РОСБАНК,,,,,Работа с большими данными. Умение программировать на <highlighttext>Python</highlighttext> и разбираться в чужом коде. Опыт моделирования и проведения оценки качества моделей.,"Валидировать, оценивать качество ML-моделей (benchmark) моделей Банка. Оценивать их бизнес-применение. Оформлять результаты валидации в отчет и предоставлять их..."
69253080,Разработчик ETL,Санкт-Петербург,Открытая,2022-09-26T10:44:19+0300,2022-09-26T10:44:19+0300,False,https://api.hh.ru/vacancies/69253080?host=hh.ru,https://hh.ru/vacancy/69253080,Тинькофф,,,,,Высшее техническое образование. Опыт работы с базами данных в качестве разработчика от 1 года. Свободное владение SQL. Понимание теории СУБД...,"Проектировать и разрабатывать процессы преобразования данных (ETL) для хранилища данных. Писать скрипты на SQL, <highlighttext>Python</highlighttext>. Проектировать потоки данных. "
69252901,Разработчик ETL,Нижний Новгород,Открытая,2022-09-26T10:44:28+0300,2022-09-26T10:44:28+0300,False,https://api.hh.ru/vacancies/69252901?host=hh.ru,https://hh.ru/vacancy/69252901,Тинькофф,,,,,Высшее техническое образование. Опыт работы с базами данных в качестве разработчика от 1 года. Свободное владение SQL. Понимание теории СУБД...,"Проектировать и разрабатывать процессы преобразования данных (ETL) для хранилища данных. Писать скрипты на SQL, <highlighttext>Python</highlighttext>. Проектировать потоки данных. "
70374987,PHP developer/программист в международный финтех (Middle+/Senior),Москва,Открытая,2022-09-26T19:39:43+0300,2022-09-26T19:39:43+0300,False,https://api.hh.ru/vacancies/70374987?host=hh.ru,https://hh.ru/vacancy/70374987,Emirex,3000.0,4000.0,USD,True,"Стек: PHP (7.2 или выше), Laravel (от 8), Doctrine, Redux, GIT; Docker, Jenkins. Опыт на аналогичном стеке, суммарный коммерческий...","Участие в разработке под новую платформу. Задачи, связанные с финтехом, криптовалютами, NFT. Работа в команде разработчиков (есть React, <highlighttext>Python</highlighttext>,Web..."
70357826,DevOps,Москва,Открытая,2022-09-26T14:22:11+0300,2022-09-26T14:22:11+0300,False,https://api.hh.ru/vacancies/70357826?host=hh.ru,https://hh.ru/vacancy/70357826,ITPO group,,,,,Навыки написания сценариев для автоматизации задач (знание Bash и/или <highlighttext>Python</highlighttext>). Будет большим плюсом опыт работы с блокчейн сетями.,"Развивать инфраструктуру, повышать свою квалификацию вместе с командой разработки, внедрять новые технологии. Повышать отказоустойчивость и доступность сервиса. Привносить дельные рекомендации..."
70337534,Lead devops (KVM),Санкт-Петербург,Открытая,2022-09-26T10:33:22+0300,2022-09-26T10:33:22+0300,False,https://api.hh.ru/vacancies/70337534?host=hh.ru,https://hh.ru/vacancy/70337534,Wanted,,350000.0,RUR,False,"Легко расскажешь разницу между VLAN и VXLAN, а также между SDN и CDN. У тебя есть опыт реализации продукта от...","Нанимать новых людей и повышать общий уровень компетенций команды. Участвовать в планировании стратегии и беклога компании, оценивать бэклог в ресурсах."
68921602,DevOps specialist,Москва,Открытая,2022-09-26T09:25:33+0300,2022-09-26T09:25:33+0300,False,https://api.hh.ru/vacancies/68921602?host=hh.ru,https://hh.ru/vacancy/68921602,Т1 Консалтинг,,400000.0,RUR,True,"Умение писать на чём-то, кроме bash, желательно на <highlighttext>python</highlighttext>. Опыт работы с keycloak или подобными OIDC/SAML провайдерами. ",Работа в командах разработки. Хорошее понимание специфики разработки WEB-проектов. Построения CI/CD пайплайнов. Работа с Docker и Kubernetes. 
70374017,Junior PHP developer,Санкт-Петербург,Открытая,2022-09-26T19:03:54+0300,2022-09-26T19:03:54+0300,False,https://api.hh.ru/vacancies/70374017?host=hh.ru,https://hh.ru/vacancy/70374017,AppMagic,,70000.0,RUR,False,"Хорошее знание PHP, будет плюсом опыт работы с Go. Базовые знания SQL, индексы, виды баз данных. Знание методологии test-driven...","Postgres, Clickhouse, Elasticsearch, RabbitMQ. Постановка задач и документация: Jira / Confluence. Инфраструктура и backend: Gitlab, Docker, Kubernetes, <highlighttext>Python</highlighttext>."
